{
  "schema_version": "1.0",
  "repository": "falker47/erdos-gyarfas-p14",
  "inspected_project_commit": "41fb0a9b64ff2c6deeeb8080f41d1ea82bcb568d",
  "task_id": "TASK-20260719__define_environment_trust_boundary",
  "generated_at_utc": "2026-07-19T09:27:06Z",
  "scope_statement": "Inventory of outcome-relevant environment selectors and trust dependencies in the repository's current GitHub Actions, Python, Docker, native-toolchain, and accepted local verification interfaces. This artifact specifies the current boundary; it does not implement an environment lock.",
  "entries": [
    {
      "id": "ENV-001-GHA-RUNNER-WHITESPACE",
      "layer": "GITHUB_ACTIONS",
      "category": "RUNNER_SELECTOR",
      "source_locations": [
        {
          "path": ".github/workflows/ci.yml",
          "line_start": 18,
          "line_end": 18,
          "selector_kind": "WORKFLOW_RUNNER",
          "expression": "runs-on: ubuntu-24.04"
        }
      ],
      "current_selector": "ubuntu-24.04",
      "observed_state": "The committed-range whitespace job selects a mutable GitHub-hosted runner label; no runner-image build identity or image digest is recorded.",
      "outcome_relevance": "The runner supplies the operating system, filesystem behavior, Python bootstrap environment, Git, shell, and service integration used by the check.",
      "classification": "MUTABLE_RESOLUTION",
      "repository_lockability": "NOT_REPOSITORY_CONTROLLED",
      "external_trust_dependencies": [
        "GitHub-hosted runner image resolution"
      ],
      "evidence": [
        ".github/workflows/ci.yml:18 declares the label and no immutable runner identity."
      ],
      "required_next_action": "Capture the resolved runner-image identity and relevant tool versions, or move the evidentiary execution to a content-addressed environment while retaining the hosted-service boundary explicitly.",
      "blocks_evidence": {
        "V1": false,
        "V3": true,
        "V4": true
      }
    },
    {
      "id": "ENV-002-GHA-RUNNER-PYTHON",
      "layer": "GITHUB_ACTIONS",
      "category": "RUNNER_SELECTOR",
      "source_locations": [
        {
          "path": ".github/workflows/ci.yml",
          "line_start": 42,
          "line_end": 42,
          "selector_kind": "WORKFLOW_RUNNER",
          "expression": "runs-on: ubuntu-24.04"
        }
      ],
      "current_selector": "ubuntu-24.04",
      "observed_state": "The Python matrix job selects a mutable GitHub-hosted runner label; no runner-image build identity or image digest is recorded.",
      "outcome_relevance": "The runner determines the platform and native substrate on which interpreter and dependency artifacts are selected and tests execute.",
      "classification": "MUTABLE_RESOLUTION",
      "repository_lockability": "NOT_REPOSITORY_CONTROLLED",
      "external_trust_dependencies": [
        "GitHub-hosted runner image resolution"
      ],
      "evidence": [
        ".github/workflows/ci.yml:42 declares the label and no immutable runner identity."
      ],
      "required_next_action": "Capture the resolved runner-image identity, platform, and relevant preinstalled state for each matrix execution, or use a content-addressed execution environment.",
      "blocks_evidence": {
        "V1": false,
        "V3": true,
        "V4": true
      }
    },
    {
      "id": "ENV-003-GHA-RUNNER-CPP",
      "layer": "GITHUB_ACTIONS",
      "category": "RUNNER_SELECTOR",
      "source_locations": [
        {
          "path": ".github/workflows/ci.yml",
          "line_start": 87,
          "line_end": 87,
          "selector_kind": "WORKFLOW_RUNNER",
          "expression": "runs-on: ubuntu-24.04"
        }
      ],
      "current_selector": "ubuntu-24.04",
      "observed_state": "The native compiler matrix job selects a mutable GitHub-hosted runner label; no runner-image build identity or image digest is recorded.",
      "outcome_relevance": "The runner supplies compilers, standard libraries, CMake, Ninja, Make, Git, shell utilities, kernel, and CPU-visible behavior used for builds and smoke checks.",
      "classification": "MUTABLE_RESOLUTION",
      "repository_lockability": "NOT_REPOSITORY_CONTROLLED",
      "external_trust_dependencies": [
        "GitHub-hosted runner image resolution"
      ],
      "evidence": [
        ".github/workflows/ci.yml:87 declares the label and no immutable runner identity."
      ],
      "required_next_action": "Capture the resolved runner image, platform, compiler, standard library, and build-tool identities for any evidence that depends on this job.",
      "blocks_evidence": {
        "V1": false,
        "V3": true,
        "V4": true
      }
    },
    {
      "id": "ENV-004-GHA-RUNNER-HEAVY",
      "layer": "GITHUB_ACTIONS",
      "category": "RUNNER_SELECTOR",
      "source_locations": [
        {
          "path": ".github/workflows/heavy-search.yml",
          "line_start": 50,
          "line_end": 50,
          "selector_kind": "WORKFLOW_RUNNER",
          "expression": "runs-on: ubuntu-24.04"
        }
      ],
      "current_selector": "ubuntu-24.04",
      "observed_state": "The non-executing heavy-workflow scaffold selects a mutable GitHub-hosted runner label; no runner-image build identity or image digest is recorded.",
      "outcome_relevance": "The runner supplies the shell, Python, hashing tools, clock, and artifact-service client used to construct and preserve the scaffold record.",
      "classification": "MUTABLE_RESOLUTION",
      "repository_lockability": "NOT_REPOSITORY_CONTROLLED",
      "external_trust_dependencies": [
        "GitHub-hosted runner image resolution"
      ],
      "evidence": [
        ".github/workflows/heavy-search.yml:50 declares the label and no immutable runner identity."
      ],
      "required_next_action": "Capture the resolved runner and tool identities for material workflow records; do not infer a future search environment from this scaffold label.",
      "blocks_evidence": {
        "V1": false,
        "V3": true,
        "V4": true
      }
    },
    {
      "id": "ENV-005-GHA-CONTROL-PLANE",
      "layer": "GITHUB_ACTIONS",
      "category": "EXTERNAL_SERVICE",
      "source_locations": [
        {
          "path": ".github/workflows/ci.yml",
          "line_start": 11,
          "line_end": 13,
          "selector_kind": "EXTERNAL_SERVICE",
          "expression": "concurrency:"
        },
        {
          "path": ".github/workflows/heavy-search.yml",
          "line_start": 158,
          "line_end": 165,
          "selector_kind": "EXTERNAL_SERVICE",
          "expression": "${GITHUB_RUN_ID}"
        }
      ],
      "current_selector": "GitHub Actions runner assignment, expression evaluation, contexts, cache, artifact, and orchestration services",
      "observed_state": "The repository pins workflow text but does not control or content-address the GitHub Actions control plane, runner protocol, expression evaluator, cache service, artifact service, or service-provided context values.",
      "outcome_relevance": "These services decide job placement, expose commit and run identities, transport cached or uploaded bytes, evaluate conditions, and mediate execution.",
      "classification": "EXTERNAL_SERVICE_TRUST",
      "repository_lockability": "NOT_REPOSITORY_CONTROLLED",
      "external_trust_dependencies": [
        "GitHub Actions control plane",
        "GitHub Actions cache and artifact services",
        "GitHub-hosted runner protocol"
      ],
      "evidence": [
        "Workflow contexts and service operations are supplied at run time and have no repository content digest."
      ],
      "required_next_action": "Define and review the external-service assumptions accepted for each evidence level, and capture service-issued run, runner, cache, and artifact identities where available.",
      "blocks_evidence": {
        "V1": false,
        "V3": true,
        "V4": true
      }
    },
    {
      "id": "ENV-006-GHA-ACTION-CHECKOUT",
      "layer": "GITHUB_ACTIONS",
      "category": "EXTERNAL_ACTION",
      "source_locations": [
        {
          "path": ".github/workflows/ci.yml",
          "line_start": 22,
          "line_end": 22,
          "selector_kind": "WORKFLOW_ACTION",
          "expression": "uses: actions/checkout@34e114876b0b11c390a56381ad16ebd13914f8d5"
        },
        {
          "path": ".github/workflows/ci.yml",
          "line_start": 52,
          "line_end": 52,
          "selector_kind": "WORKFLOW_ACTION",
          "expression": "uses: actions/checkout@34e114876b0b11c390a56381ad16ebd13914f8d5"
        },
        {
          "path": ".github/workflows/ci.yml",
          "line_start": 101,
          "line_end": 101,
          "selector_kind": "WORKFLOW_ACTION",
          "expression": "uses: actions/checkout@34e114876b0b11c390a56381ad16ebd13914f8d5"
        },
        {
          "path": ".github/workflows/heavy-search.yml",
          "line_start": 61,
          "line_end": 61,
          "selector_kind": "WORKFLOW_ACTION",
          "expression": "uses: actions/checkout@34e114876b0b11c390a56381ad16ebd13914f8d5"
        }
      ],
      "current_selector": "actions/checkout@34e114876b0b11c390a56381ad16ebd13914f8d5",
      "observed_state": "All checkout occurrences select the accepted actions/checkout v4.3.1 commit. The Action repository source identity is content-pinned; its execution service and Node runtime are separate entries.",
      "outcome_relevance": "Checkout determines which repository bytes and history reach later checks.",
      "classification": "IMMUTABLE_PIN",
      "repository_lockability": "REPOSITORY_PINNABLE",
      "external_trust_dependencies": [
        "GitHub Action source delivery",
        "GitHub Actions execution service"
      ],
      "evidence": [
        "The accepted Action-pin dossier verified the official commit object and action.yml at this SHA."
      ],